retailer_product_id,barcode,product_name,original_retailer_name,current_price,pack_size,normalized_price,store_id,can_normalize
9621,7290111347115,PURE MEGA נייר טואלט דו שכבתי בגוון לבן 18 גלילי מגה (₪9.23 ,לילי PURE MEGA נ.ט. לבן 18 גלילים,9.23,100.0,923.0,52001,True
9623,7702018866984,ג'ילט פיוז'ן מחסנית סכיני גילוח רב פעמיים 4 סכינים (₪20.23 ל,גילט פיוזן ידני סכיני גילוח 4 יחידות,20.23,4.0,80.92,52001,True
9625,7290000201801,PURE נייר טואלט דו שכבתי מהדורה מוזהבת - 150 דף בגליל במקום ,לילי PURE נ.ט. 24 גלילים מהדורה מוזהבת,8.67,100.0,867.0,52001,True
9695,7290118208976,גילוח חד פעמיים 2 להבים ראש מתכוונן (₪3.18 ליחידה),לייף סכיני גילוח חדפ דו להבי 5 יח לנשים,3.18,5.0,15.9,52001,True
9712,4210201388470,ראשי מילוי למברשת שיניים חשמלית לילדים ספיידרמן אריזת רביעיי,אורל בי ראש חשמלי לילדים ספיידרמן 4 יחיד,29.23,4.0,116.92,52001,True
9782,7290000187921,PURE נייר טואלט דו שכבתי בגוון לבן - 150 דף בגליל במקום 155 ,לילי PURE נ.ט. לבן 32 גלילים,8.5,100.0,850.0,52001,True
9784,7290114965507,בייביז דריי פרוטקט חיתולים מידה 2 (₪0.56 ליחידה),בייביז דריי פרוטקט חיתולים מידה 2 46 יח,0.56,46.0,25.76,52001,True
9814,9001616672675,זוג מגיני פטמה (₪29.95 ליחידה),מאם זוג מגיני פטמה,29.95,2.0,59.9,52001,True
9826,5010622018258,חוט דנטאלי דמוי סאטן בטעם מנטה 25 מטר (₪0.96 ל-1 מטר),אורל בי חוט דנטלי סאטין 25 מטר,0.96,25.0,24.0,52001,True
9832,7290016437652,פנטס תחתוני חיתולים האגיס פנטס מידה 6 15- (₪1.96 ליחידה),האגיס פרידום דריי פנטס מידה 6 26 יחידות,1.96,26.0,50.96,52001,True
9852,7290013848345,99.9% מחטא מטליות לחיטוי ולניקוי יסודי 50 יח' - אריזת שלישיי,סנו 99.9% מחטא מטליות לחיטוי שלישייה,6.97,3.0,20.91,52001,True
9903,5713795200689,מוצץ סיליקון ONE SIZE DE LUX זוג (₪39.95 ליחידה),BIBS מוצץ סיליקון DE LUX שמנת ירוק,39.95,2.0,79.9,52001,True
9927,7290120930353,לייף מסכות פנים רפואיות פריים-שילד מבד היפואלרגני (₪0.99 ליח,לייף מסכות פנים פריים-שילד 10 יח,0.99,10.0,9.9,52001,True
9928,3614274368116,"RENERGIE TRIPLE SERUM RETINOL סרום (₪1,368 ל-)",לנקום רנרגי מולטי ליפט טריפל סרום עם רטי,1368.0,3.0,4104.0,52001,True
9931,5713795229123,מוצץ לטקס מידה 1 BOHEME זוג (₪39.95 ליחידה),BIBS מוצץ לטקס מידה 1 BOHEME שמנת ירוק,39.95,2.0,79.9,52001,True
11018,7290119918676,בייביז מוצצי סיליקון אורתודונטי +12 בנים (₪17.45 ליחידה),זוג מוצצי סיליקון אורתודונטי +12 בנים,17.45,2.0,34.9,52001,True
11799,7290113850132,לייף לייף קידס תחתונים להרטבת לילה לילדים בוגרים M 10 תחתוני,לייף קידס חיתולי לילה 10 יחידות M,3.32,10.0,33.199999999999996,52001,True
11815,4008600402138,סטאר יום ולילה 0-6 חודשים כחול (₪22.95 ליחידה),נוק זוג מוצצים סטאר יום ולילה 0-6 ח כחול,22.95,2.0,45.9,52001,True
12281,7610472880227,לאחסון חלב אם (₪1.80 ליחידה),שקיות לאחסון חלב אם 50 יחידות,1.8,50.0,90.0,52001,True
12606,5713795259687,סטודיו מוצץ לטקס מידה 1 IVORY STEEL BLUE זוג (₪39.95 ליחידה),BIBS מוצצי לטקס מידה 1 IVORY STEEL BLUE,39.95,2.0,79.9,52001,True
13324,7290109314846,בייביז רפידות הנקה לבנות (₪0.60 ליחידה),לייף בייביז רפידות הנקה 30 יח לבן,0.6,30.0,18.0,52001,True
13449,7290014952720,משחת החתלה קלנדולה קלאסיק - מארז * (₪23.58 ל-),מארז שלישייה משחת החתלה קלנדולה קלאסיק,23.58,3.0,70.74,52001,True
14955,8700216575324,פרימיום חיתולים שלב 7 (₪2.33 ליחידה),פמפרס פרימיום חיתולים שלב 7 21 יח,2.33,21.0,48.93,52001,True
15147,8700216350433,אקטיב בייבי דריי חיתולים בייבי דריי מידה 2 4- (₪1 ליחידה),פמפרס בייבי דריי מידה 2  43 יחידות,1.0,43.0,43.0,52001,True
15232,7290104963940,מגבוני פחם שחורים להסרת איפור פנים ועיניים (₪0.68 ליחידה),קרליין מגבוני פחם שחורים 25 יחידות,0.68,25.0,17.0,52001,True
15360,4008600404477,ספייס מיקי 6-18 חודשים (₪22.95 ליחידה),נוק זוג מוצצים ספייס מיקי 6-18 חודשים אפ,22.95,2.0,45.9,52001,True
15431,7290117388082,רפידות הנקה חד פעמיות גודל SIZE M (₪0.60 ליחידה),בלונס בייבי רפידות הנקה 50 יחידות M,0.6,50.0,30.0,52001,True
15787,5713795236329,מוצץ לטקס מידה 1 BOHEME זוג (₪39.95 ליחידה),BIBS מוצץ לטקס מידה 1 BOHEME תכלת טורקיז,39.95,2.0,79.9,52001,True
15970,4008600404507,ספייס מיקי 0-6 חודשים (₪22.95 ליחידה),נוק זוג מוצצים ספייס מיקי 0-6 חודשים אדו,22.95,2.0,45.9,52001,True
17794,7290119918638,בייביז מוצצי סיליקון אורתודונטי +12 בנות (₪17.45 ליחידה),זוג מוצצי סיליקון אורתודונטי +12 בנות,17.45,2.0,34.9,52001,True
17999,7290120935235,מ.הגנה SPF50 ספריי שקוף מארז זוג (₪17.48 ל-),לייף מ.הגנה SPF50 ספריי שקוף 200 מל מארז,17.48,2.0,34.96,52001,True
24910,9001616840081,SUPREME NIGHT מוצצי סיליקון 6+ זוהרים בלילה ורוד-סגול (₪40.4,מאם זוג מוצצים SUPREME סיליקון 6+ ורוד ס,40.45,2.0,80.9,52001,True
27310,9001616840074,SUPREME NIGHT מוצצי סיליקון 6+ זוהרים בלילה כחול-תכלת (₪40.4,מאם זוג מוצצים SUPREME סיליקון 6+ כחול ת,40.45,2.0,80.9,52001,True
53072,9001616840043,SUPREME NIGHT מוצצי סיליקון 0-6 זוהרים בלילה כחול-תכלת (₪40.,מאם זוג מוצצים SUPREME סיליקון 0-6 כחול,40.45,2.0,80.9,52001,True
53509,9001616840098,SUPREME NIGHT מוצצי סיליקון 6+ זוהרים בלילה ירוק-לבן (₪40.45,מאם זוג מוצצים SUPREME סיליקון 6+ ירוק ל,40.45,2.0,80.9,52001,True
54741,9001616840050,SUPREME NIGHT מוצצי סיליקון 0-6 זוהרים בלילה ורוד-סגול (₪40.,מאם זוג מוצצים SUPREME סיליקון 0-6 ורוד,40.45,2.0,80.9,52001,True
55749,9001616840067,SUPREME NIGHT מוצצי סיליקון 0-6 זוהרים בלילה לבן-אפור (₪40.4,מאם זוג מוצצים SUPREME סיליקון 0-6 לבן א,40.45,2.0,80.9,52001,True
72826,7290017088099,"חיתולים מידה 6 16+ ק""ג (₪1.03 ליחידה)",בייביסיטר חיתולים מידה 6 30 יחידות,1.03,30.0,30.900000000000002,52001,True
92804,7290113712010,חד פעמיות (₪0.07 ליחידה),סאנדיי כפפות ניילון חד פעמיות 100 יח,0.07,100.0,7.000000000000001,52001,True
99360,7290017088068,חיתולים מידה 4 8- (₪0.83 ליחידה),בייביסיטר חיתולים מידה 4 42 יחידות,0.83,42.0,34.86,52001,True
108800,783495578697,5 הומנפלורה LPLDL פרוביוטיקה 30 כמוסות (₪5.66 ליחידה),קטגורי 5 הומנפלורה LPLDL פרוביוטיקה,5.66,30.0,169.8,52001,True
110461,5713795228089,מוצץ לטקס מידה 1 COLOUR זוג (₪39.95 ליחידה),BIBS מוצץ לטקס מידה 1 COLOUR ורוד אדום,39.95,2.0,79.9,52001,True
179470,7290014981638,נוטריקר מאש פורס 60 כמוסות (₪2.78 ליחידה),נוטריקר מאש פורס 60 כמוסות,2.78,60.0,166.79999999999998,52001,True
198233,7290017088051,חיתולים מידה 3 5- (₪0.70 ליחידה),בייביסיטר חיתולים מידה 3 50 יחידות,0.7,50.0,35.0,52001,True
228762,5060062992588,לאחסון חלב אם 25 שקיות (₪1.92 ליחידה),לנסינו שקיות לאחסון חלב אם 25 יחידות,1.92,25.0,48.0,52001,True
253725,3346470617971,"ABEILLE ROYALE DOUBLE R סרום עיניים (₪3,075 ל-)",גרלן אביי רויאל סרום עיניים דאבל R,3075.0,2.0,6150.0,52001,True
862108,5713795221431,מוצץ סיליקון ONE SIZE DE LUX זוג (₪39.95 ליחידה),BIBS מוצץ סיליקון DE LUX שזיף אפרסק,39.95,2.0,79.9,52001,True
1135221,5713795236602,מוצץ סיליקון ONE SIZE DE LUX זוג (₪39.95 ליחידה),BIBS מוצץ סיליקון DE LUX סגול טאידאי,39.95,2.0,79.9,52001,True
1205152,7290017088075,חיתולים מידה +4 10- (₪0.87 ליחידה),בייביסיטר חיתולים מידה +4 40 יחידות,0.87,40.0,34.8,52001,True
1207966,7290017088983,חיתולים NB מידה 2 3- (₪0.79 ליחידה),בייביסיטר חיתולים NB מידה 2 38 יחידות,0.79,38.0,30.020000000000003,52001,True
1218507,7290017088082,חיתולים מידה 5 12- (₪0.97 ליחידה),בייביסיטר חיתולים מידה 5 36 יחידות,0.97,36.0,34.92,52001,True
1235420,5019090517621,כוסות שתייה (₪11.47 ליחידה),כוסות שתייה 4 יחידות,11.47,4.0,45.88,52001,True
1237510,037977400144,ריחניות לטיטולים (₪0.41 ליחידה),שקיות ריחניות לטיטולים 100 יחידות,0.41,100.0,41.0,52001,True
1369350,7290017088969,חיתולים NB מידה 1 2- (₪0.71 ליחידה),בייביסיטר חיתולים NB מידה 1 42 יחידות,0.71,42.0,29.82,52001,True
2224793,5060062992526,רפידות הנקה 24 יח (₪1.29 ליחידה),לנסינו רפידות הנקה 24 יח,1.29,24.0,30.96,52001,True
10394643,7290018439234,נוטריקר אבקת עשב שעורה טהורה בכמוסות 60 כמוסות (₪247.22 ל-),נוטריקר אבקת עשב שעורה טהורה בכמוסות 60 כמוסות (₪247.22 ל-),247.22,60.0,14833.2,52001,True
10394697,7290015129497,סקיני פסטה מארז 20 יח' סקיני בר בתוספת קקאו ושוקולד (₪3 ליחי,סקיני פסטה מארז 20 יח' סקיני בר בתוספת קקאו ושוקולד (₪3 ליחי,3.0,20.0,60.0,52001,True
10394701,7290015129480,סקיני פסטה מארז 20 יח' סקיני בר בתוספת אגוזי לוז וקינמון (₪3,סקיני פסטה מארז 20 יח' סקיני בר בתוספת אגוזי לוז וקינמון (₪3,3.0,20.0,60.0,52001,True
10394706,7290015129466,סקיני פסטה מארז 20 יח' סקיני בר בתוספת תפוח וקינמון (₪3 ליחי,סקיני פסטה מארז 20 יח' סקיני בר בתוספת תפוח וקינמון (₪3 ליחי,3.0,20.0,60.0,52001,True
10394763,9555192508755,ריגליס Wrigley's Chewy DoubleMint ריגלי סוכריות רכות בטעם מנ,ריגליס Wrigley's Chewy DoubleMint ריגלי סוכריות רכות בטעם מנ,37.5,2.0,75.0,52001,True
10394855,7290015129473,סקיני פסטה מארז 20 יח' סקיני בר בתוספת צימוקים וחמוציות (₪3 ,סקיני פסטה מארז 20 יח' סקיני בר בתוספת צימוקים וחמוציות (₪3 ,3.0,20.0,60.0,52001,True
10394962,3045206312257,מגבונים לחיטוי כללי 36 יח' (₪0.41 ליחידה),יעקבי דזיטול - מגבונים לחיטוי כללי 36 יח' (₪0.41 ליחידה),0.41,36.0,14.76,52001,True
10394968,0612477570964,"בדים יוקרתי - הונולולו 1 יחידה, (‫₪12.86 ל-‬)","מיוסנט מבשם בדים יוקרתי - הונולולו 1 יחידה, (₪12.86 ל-)",12.86,1.0,12.86,52001,True
10394978,7290109921303,SLIM טורבול - זוג סופגי לחות חד פעמיים 200 גר' (₪0.22 ל-),יעקבי SLIM טורבול - זוג סופגי לחות חד פעמיים 200 גר' (₪0.22 ,0.22,2.0,0.44,52001,True
10395027,7290109924137,יעקבי אסטוניש קפסולות לניקוי כלים במדיח 42 יח' (₪1.31 ליחידה,יעקבי אסטוניש קפסולות לניקוי כלים במדיח 42 יח' (₪1.31 ליחידה,1.31,42.0,55.02,52001,True
10395034,096619105489,Kirkland Signature קפסולות כביסה Kirkland Ultra Clean (152 י,Kirkland Signature קפסולות כביסה Kirkland Ultra Clean (152 י,1.18,152.0,179.35999999999999,52001,True
10395093,7895742266493,Morelli Morelli Bioflex Toothbrush מברשת שיניים לטיפול אורתו,Morelli Morelli Bioflex Toothbrush מברשת שיניים לטיפול אורתו,25.0,4.0,100.0,52001,True
10395127,1244444425893,שפדלים מקלות עץ גדולים 100 יח בחבילה לשימוש חד פעמי (₪0.15 ל,Depileve שפדלים מקלות עץ גדולים 100 יח בחבילה לשימוש חד פעמי,0.15,100.0,15.0,52001,True
10395137,1244444425886,שפדלים מקלות עץ צרים 200 יח בחבילה לשימוש חד פעמי (₪0.10 ליח,Depileve שפדלים מקלות עץ צרים 200 יח בחבילה לשימוש חד פעמי (,0.1,200.0,20.0,52001,True
10395141,1244444430156,דפילבוקס 400 יח׳ DEPILBOX CLASSIC דפילב 400 יח׳ (₪0.30 ליחיד,Depileve דפילבוקס 400 יח׳ DEPILBOX CLASSIC דפילב 400 יח׳ (₪0,0.3,400.0,120.0,52001,True
10395143,1244444430163,מגן טבעת 50 יח׳ COLLAR RINGS דפילב 50 יח׳ (₪1.18 ליחידה),Depileve מגן טבעת 50 יח׳ COLLAR RINGS דפילב 50 יח׳ (₪1.18 לי,1.18,50.0,59.0,52001,True
10395169,1244444430224,ספטולות גוף 100 יח׳ BODY APPLICATOR SPATULAS דפילב 100 יח׳ (,Depileve ספטולות גוף 100 יח׳ BODY APPLICATOR SPATULAS דפילב ,0.19,100.0,19.0,52001,True
10395170,1244444430538,שקית ניילון פרפין 100יח׳ PLASTIC LINERS דפילב 100 יח׳ (₪1.05,Depileve שקית ניילון פרפין 100יח׳ PLASTIC LINERS דפילב 100 י,1.05,100.0,105.0,52001,True
10395171,1244444430286,רצועות שעווה לגוף 100 יח׳ BODY STRIPS דפילב 100 יח׳ (₪0.35 ל,Depileve רצועות שעווה לגוף 100 יח׳ BODY STRIPS דפילב 100 יח׳,0.35,100.0,35.0,52001,True
10395172,1244444430293,רצועות שעווה לפנים 100 יח׳ FACIAL STRIPS דפילב 100 יח׳ (₪0.3,Depileve רצועות שעווה לפנים 100 יח׳ FACIAL STRIPS דפילב 100 ,0.35,100.0,35.0,52001,True
10395194,1244444430187,מחזיק לפחית שעווה WAX CAN HOLDER דפילב 50 יח׳ (₪0.70 ליחידה),Depileve מחזיק לפחית שעווה WAX CAN HOLDER דפילב 50 יח׳ (₪0.7,0.7,50.0,35.0,52001,True
10395230,023243007476,רחצה מוצק טבעי אבוקדו שלישייה (₪14.97 ל-),ירדן סבון רחצה מוצק טבעי אבוקדו שלישייה (₪14.97 ל-),14.97,3.0,44.910000000000004,52001,True
10395283,7296168012174,Salux שלישייה (₪29.97 ליחידה),TopMed Salux שלישייה (₪29.97 ליחידה),29.97,3.0,89.91,52001,True
10395393,23243007476,רחצה מוצק טבעי שלישייה (₪16.63 ל-),ירדן סבון רחצה מוצק טבעי שלישייה (₪16.63 ל-),16.63,3.0,49.89,52001,True
10395425,9421907199184,הלו - זוג גביעוניות במידות S+M (₪112.50 ליחידה),הלו - זוג גביעוניות במידות S+M (₪112.50 ליחידה),112.5,2.0,225.0,52001,True
10395443,7290019755074,"de Joie Deep Hydration - ג'ל לחות ליובש בנרתיק ללא הורמונים,",Secret de Joie Deep Hydration - ג'ל לחות ליובש בנרתיק ללא הו,33.8,5.0,169.0,52001,True
10395453,9421907199177,הלו - זוג גביעוניות במידות M+L (₪112.50 ליחידה),הלו - זוג גביעוניות במידות M+L (₪112.50 ליחידה),112.5,2.0,225.0,52001,True
10395482,72900114393091,זוג - קרם רב שימושי מועשר בתמצית רימונים (₪16.12 ל-),Nava זוג - קרם רב שימושי מועשר בתמצית רימונים (₪16.12 ל-),16.12,2.0,32.24,52001,True
10395833,8033765642347,KAY SEEING DOUBLE א.ד.פ לאשה (₪124 ל-),MISS KAY SEEING DOUBLE א.ד.פ לאשה (₪124 ל-),124.0,2.0,248.0,52001,True
10396085,5350555013358,זוג ראשי מברשת שיניים חשמלית גודל מדיום (₪17.50 ליחידה),זוג ראשי מברשת שיניים חשמלית גודל מדיום (₪17.50 ליחידה),17.5,2.0,35.0,52001,True
10396110,0693493220446,pump pro double - ביאמבה פאמפ פרו משאבת חלב זוגית (₪645 ליחי,Biamba Biamba pump pro double - ביאמבה פאמפ פרו משאבת חלב זו,645.0,2.0,1290.0,52001,True
10396114,3700487045088,מארז 2 זוגות רפידות הנקה יום (₪49.50 ליחידה),מארז 2 זוגות רפידות הנקה יום (₪49.50 ליחידה),49.5,2.0,99.0,52001,True
10396119,5713795252701,זוג מוצצים PINE/CORNFLOWE גודל 1 (₪39.95 ליחידה),זוג מוצצים PINE/CORNFLOWE גודל 1 (₪39.95 ליחידה),39.95,2.0,79.9,52001,True
10396120,5713795255184,זוג מוצצים DUSTYPINK/CORAL גודל 1 (₪39.95 ליחידה),זוג מוצצים DUSTYPINK/CORAL גודל 1 (₪39.95 ליחידה),39.95,2.0,79.9,52001,True
10396121,5713795242009,זוג מוצצים סופרים סיליקון SAND/IRON גודל 1 (₪39.95 ליחידה),זוג מוצצים סופרים סיליקון SAND/IRON גודל 1 (₪39.95 ליחידה),39.95,2.0,79.9,52001,True
10396124,37977800463,נשכנים מצוננים פרפר (₪12.45 ליחידה),סאסי זוג נשכנים מצוננים פרפר (₪12.45 ליחידה),12.45,2.0,24.9,52001,True
10396125,5713795252725,זוג מוצצים VIOLETSK/PUMPKIN גודל 1 (₪39.95 ליחידה),זוג מוצצים VIOLETSK/PUMPKIN גודל 1 (₪39.95 ליחידה),39.95,2.0,79.9,52001,True
10396126,608028959340,מארז 4 חבילות - היחידים שנקיים מכימיקלים (₪11.25 ליחידה),Only Wipes מארז 4 חבילות - היחידים שנקיים מכימיקלים (₪11.25 ,11.25,4.0,45.0,52001,True
10396127,97200160922356,12 יח׳ מגבונים רכים במיוחד לתינוק - ללא בישום (₪5.83 ליחידה),אליסיום מארז 12 יח׳ מגבונים רכים במיוחד לתינוק - ללא בישום (,5.83,12.0,69.96000000000001,52001,True
10396128,97200160922288-3,שלישייה מגבונים אליסיום רכים במיוחד לתינוק - ללא בישום (₪6.6,אליסיום מארז שלישייה מגבונים אליסיום רכים במיוחד לתינוק - לל,6.63,3.0,19.89,52001,True
10396130,7290019227427,"מגבוני הקסם, מגבון שנפתח בקסם – 50 יח’ (₪0.36 ליחידה)","מגבוני הקסם, מגבון שנפתח בקסם – 50 יח’ (₪0.36 ליחידה)",0.36,50.0,18.0,52001,True
10396137,7290011363598,מגבונים היפואלרגניים עבים אריזת שלישייה (₪16.97 ליחידה),מגבוני פרוקטו מגבונים היפואלרגניים עבים אריזת שלישייה (₪16.9,16.97,3.0,50.91,52001,True
10396139,7290019075271,"ד""ר פישר פרוקטו סופט מגבונים היגיינים לניקוי יסודי והרגעה בא","ד""ר פישר פרוקטו סופט מגבונים היגיינים לניקוי יסודי והרגעה בא",0.24,3.0,0.72,52001,True
10396141,7290016621907,"ד""ר פישר פרוקטו סופט מגבונים היגיינים לניקוי יסודי והרגעה בא","ד""ר פישר פרוקטו סופט מגבונים היגיינים לניקוי יסודי והרגעה בא",0.42,50.0,21.0,52001,True
10396148,7290119910106,כמוסות ליקוויד ג'ל 40 כמוסות נוזל (₪1.17 ליחידה),לייף איבופרו כמוסות ליקוויד ג'ל 40 כמוסות נוזל (₪1.17 ליחידה,1.17,40.0,46.8,52001,True
10396149,7290119910113,כמוסות ליקוויד ג'ל 16 כמוסות נוזל (₪1.74 ליחידה),לייף איבופרו כמוסות ליקוויד ג'ל 16 כמוסות נוזל (₪1.74 ליחידה,1.74,16.0,27.84,52001,True
10396150,7290015912938,ליקוויד ג'ל 200 - חדש 16 כמוסות נוזל (₪1.89 ליחידה),אדקס כמוסות ליקוויד ג'ל 200 - חדש 16 כמוסות נוזל (₪1.89 ליחי,1.89,16.0,30.24,52001,True
10396152,7290015912914,ליקוויד ג'ל 400 - חדש 20 כמוסות נוזל (₪2.51 ליחידה),אדקס כמוסות ליקוויד ג'ל 400 - חדש 20 כמוסות נוזל (₪2.51 ליחי,2.51,20.0,50.199999999999996,52001,True
10396157,7290019501688,"ד""ר פישר פרוקטו סופט מגבונים נשטפים ומתכלים באסלה - מארז 3 *","ד""ר פישר פרוקטו סופט מגבונים נשטפים ומתכלים באסלה - מארז 3 *",0.34,3.0,1.02,52001,True
10396161,72900057141082,"שורשים N Belly קומפלקס צמחים, חומצה לינולאית, חומץ תפוחים, ל","שורשים N Belly קומפלקס צמחים, חומצה לינולאית, חומץ תפוחים, ל",2.76,2.0,5.52,52001,True
10396162,7290019827115,קפסולות ProBiotics+ 30 קפסולות (₪630 ל-),קפסולות ProBiotics+ 30 קפסולות (₪630 ל-),630.0,30.0,18900.0,52001,True
10396163,7290011606312,גלוקוסטנדרט גלוקוצויס טבליות גלוקוז 4 גר-פטל-20 יח (₪0.96 לי,גלוקוסטנדרט גלוקוצויס טבליות גלוקוז 4 גר-פטל-20 יח (₪0.96 לי,0.96,20.0,19.2,52001,True
10396170,7290011606350,גלוקוסטנדרט גלוקוצויס טבליות גלוקוז 4 גר-תפוז-20 יח (₪0.96 ל,גלוקוסטנדרט גלוקוצויס טבליות גלוקוז 4 גר-תפוז-20 יח (₪0.96 ל,0.96,20.0,19.2,52001,True
10396180,7290102749805,"לייף אגד רפואי מנייר 2.5 ס""מ*9 מטר 9 מטר (₪1.66 ל-1 מטר)","לייף אגד רפואי מנייר 2.5 ס""מ*9 מטר 9 מטר (₪1.66 ל-1 מטר)",1.66,9.0,14.94,52001,True
10396182,7290102749850,"לייף אגד רפואי שקוף 2.5 ס""מ*9 מטר 9 מטר (₪1.66 ל-1 מטר)","לייף אגד רפואי שקוף 2.5 ס""מ*9 מטר 9 מטר (₪1.66 ל-1 מטר)",1.66,9.0,14.94,52001,True
10396189,6291103652416,נקסקר סופטנפלקס אחיד,3M נקסקר פלסטר סופטנ'פלקס גמיש ונמתח - גודל אחיד (₪1.20 ליחי,1.2,3.0,3.5999999999999996,52001,True
10396190,7290102749799,"לייף אגד רפואי מנייר 1.25 ס""מ*9 מטר 9 מטר (₪1.32 ל-1 מטר)","לייף אגד רפואי מנייר 1.25 ס""מ*9 מטר 9 מטר (₪1.32 ל-1 מטר)",1.32,9.0,11.88,52001,True
10396192,4054596760080,פלסטרים נקסקר מעורב,3M נקסקר פלסטר ווטרפרוף אטום בפני מים שקוף ודק במיוחד – במגו,1.2,3.0,3.5999999999999996,52001,True
10396193,7290118201281,לייף חבישה רכה עם דבק לחתוך עצמי 1 מטר (₪26.90 ל-1 מטר),לייף חבישה רכה עם דבק לחתוך עצמי 1 מטר (₪26.90 ל-1 מטר),26.9,1.0,26.9,52001,True
10396195,7290103439521,"לייף תחבושת אלסטית רוחב 7.5 ס""מ 4.5 מטר 4.5 מטר (‫₪4.42 ל-1 ","לייף תחבושת אלסטית רוחב 7.5 ס""מ 4.5 מטר 4.5 מטר (‫₪4.42 ל-1 ",4.42,5.0,22.1,52001,True
10396198,4054596758742,נקסקר אקטיב מעורב,3M נקסקר פלסטר אקטיב מרופד נצמד לעור לח במגוון גדלים (₪1.20 ,1.2,3.0,3.5999999999999996,52001,True
10396199,7290102749843,"לייף לייף אגד רפואי שקוף רוחב 1.25 ס""מ אורך 9 מטר 9 מטר (₪1.","לייף לייף אגד רפואי שקוף רוחב 1.25 ס""מ אורך 9 מטר 9 מטר (₪1.",1.21,9.0,10.89,52001,True
10396201,7290004351199,"3M נקסקר אגד רפואי דביק מנייר בדיספנסר - עדין ונושם ""0.5 9.1","3M נקסקר אגד רפואי דביק מנייר בדיספנסר - עדין ונושם ""0.5 9.1",1.65,1.0,1.65,52001,True
10396204,7290113820173,"לייף אגד רפואי מבד דמוי משי 2 ס""מ*5 מטר 5 מטר (₪3.78 ל-1 מטר","לייף אגד רפואי מבד דמוי משי 2 ס""מ*5 מטר 5 מטר (₪3.78 ל-1 מטר",3.78,5.0,18.9,52001,True
10396205,0051131995253,3M נקסקר פלסטר ווטרפרוף אטום בפני מים שקוף ודק במיוחד – גודל,3M נקסקר פלסטר ווטרפרוף אטום בפני מים שקוף ודק במיוחד – גודל,1.79,3.0,5.37,52001,True
10396206,0051131997172,3M נקסקר פלסטר אקטיב מרופד נצמד לעור לח רחב מאוד (₪5.11 ליחי,3M נקסקר פלסטר אקטיב מרופד נצמד לעור לח רחב מאוד (₪5.11 ליחי,5.11,3.0,15.330000000000002,52001,True
10396207,0051131000162,"3M נקסקר אגד רפואי דביק מנייר - עדין ונושם ""2 9.14 מטר (₪3.3","3M נקסקר אגד רפואי דביק מנייר - עדין ונושם ""2 9.14 מטר (₪3.3",3.38,14.0,47.32,52001,True
10396208,7290013575326,"פד לכויות 10X10 ס""מ 10 יח","פירסט און פד לכוויות 10*10 ס""מ (₪2.39 ליחידה)",2.39,10.0,23.900000000000002,52001,True
